[
  {
    "id": "1918-russian-civil-war:historiography-why-the-whites-lost",
    "title": "Did the Reds win, or did the Whites lose?",
    "question": "Five years, six fronts, foreign money and foreign troops, and at the end of it the side that had held Moscow in 1918 held everything. Was that a victory the Bolsheviks won, or a defeat the anti-Bolsheviks inflicted on themselves - and if the second, what exactly did they lose it on?",
    "positions": [
      {
        "label": "The centre, the railways, and a year's head start",
        "who": "William Henry Chamberlin (1935)",
        "summary": "A geographical and administrative answer. The Bolsheviks held the centre and their enemies were on the circumference: 'Kolchak in the East, Denikin in the South, Yudenitch in the West, Miller in the North, were separated from each other by wide stretches of land and sea and were unable to coordinate their military efforts, to send reinforcements to one another. The Reds, on the other hand, operating on interior lines, could strengthen the front that seemed most critical at any given moment at the expense of the others.'[^chamberlin-1935-2]\n\nTwo further advantages come with the centre. 'By far the larger part of the munitions and other war material which had been accumulated for use in the World War was in Bolshevik territory; this was a very great advantage and more than offset the aid in munitions and supplies which the Whites received from abroad.' And time: Soviet power dated from November 1917, Kolchak from a year later, 'and still more time elapsed before Denikin emerged from his original position as a local figure in the North Caucasus'.[^chamberlin-1935-2]"
      },
      {
        "label": "They had no politics to win with",
        "who": "Alexandre Sumpf (2014)",
        "summary": "A political answer, and the one the post-archival surveys reach for: 'That is surely what the Whites were lacking to win: the unity provided by an ideology, an uncontested leader and a clearly defined project for a multiethnic nation in revolution.'[^sumpf-2014]\n\nOn this reading the White defeat is written into the slogan - Russia one, great and indivisible - which told the Finns, the Poles, the Balts, the Ukrainians, the Cossack governments and the Caucasus that a White victory meant their own extinction, and told the peasant nothing at all about the land. Chamberlin, thirty years before the archives, put the same thing in the vocabulary of the 1930s: the White movement 'produced no Mussolini, no Hitler', because it brought forward officers 'accustomed to commanding and not to persuading or agitating'.[^chamberlin-1935-2]"
      },
      {
        "label": "It was decided in the villages, and the Reds were the lesser evil",
        "who": "Orlando Figes (1996) - stated from his work, not quoted",
        "summary": "The social answer, and the one that makes the peasantry the actor rather than the terrain: the war was settled by tens of millions of people who wanted neither side, and who concluded that a Red victory meant requisitioning while a White victory meant the landlord coming back with a whip. They deserted from both armies in enormous numbers and rose against both, and the difference that mattered was one of degree and of timing.\n\n**This position is stated from the central argument of Figes's A People's Tragedy and is not quoted, because that book could not be opened at page level from this environment.** It is put on the card because leaving it off would make the argument look like one between generals. Chamberlin, who can be quoted, reaches the same place from the other direction: 'what was important in determining the course of the civil war was not the fact of peasant discontent, but the degree of it. And the Soviets passed this test more successfully than the Whites.'[^chamberlin-1935-2]"
      },
      {
        "label": "The intervention was never on a scale that could decide anything",
        "who": "Evan Mawdsley (2014)",
        "summary": "Against the formula of fourteen foreign armies, which was Soviet historiography's answer to the question and is still the popular one. Mawdsley, who wrote the standard history of the war, describes the whole of 1918 like this: direct action by British, French, American and Japanese forces 'was confined to occupation of remote ports in the northern parts of European Russia and of Vladivostok on the Pacific'.[^mawdsley-2014] And on why it did not grow after November 1918, when the reason for it had been the Eastern Front: 'Victory eliminated the main incentive and military potential for large-scale involvement in Russia.'[^mawdsley-2014]\n\nWhat the intervention did supply was material, recognition and a great deal of usable propaganda for the other side - a Red Army raised on the claim that it was fighting the world. Whether that traded favourably for the Whites is a question this card leaves open."
      }
    ],
    "settled": "Not in dispute: that the anti-Bolshevik commands never had a unified command, a common political programme or a means of coordinating operations across four thousand kilometres; that Orel on 13 October 1919 was the closest any of them came; that the peasantry was hostile both to grain requisitioning and to the restoration of the landlords; and that the Bolsheviks held Moscow, Petrograd, the central industrial region and the arsenals of the World War from first to last.",
    "unread": "The four works that hold the modern versions of these positions could not be opened from this environment, and the card says so rather than pretending otherwise. Evan Mawdsley's The Russian Civil War (1987) is borrow-only on the Internet Archive, which is why he is quoted here from an open-access encyclopedia article instead of from his own book. Peter Kenez's two volumes on south Russia - the standard statement of the political-failure case, and the reason it is usually attributed to him rather than to Sumpf - are borrow-only. Jonathan Smele's The 'Russian' Civil Wars, 1916-1926 (2015), which argues that the singular in the question is itself the mistake and that there was no one war and no one 'Whites', is not readable here at all; that position is therefore named nowhere on this card, which is a real gap. And Figes could not be read at page level, which is why his position is marked as stated. Raising this card to the full bar of ADR 0017 needs those four books in hand.",
    "links": {
      "events": [
        "1918-russian-civil-war:event-orel-taken",
        "1918-russian-civil-war:event-kolchak-coup",
        "1918-russian-civil-war:event-makhno-takes-ekaterinoslav",
        "1918-russian-civil-war:event-committees-of-the-poor",
        "1918-russian-civil-war:event-archangel-landing"
      ],
      "formations": [
        "1918-russian-civil-war:formation-afsr",
        "1918-russian-civil-war:formation-allied-north-russia",
        "1918-russian-civil-war:formation-makhno-army"
      ],
      "people": ["person:denikin-anton", "person:kolchak-alexander", "person:makhno-nestor"]
    },
    "sources": [
      {
        "source": "source:chamberlin-1935-2",
        "pages": "454-457",
        "note": "the chapter 'The Revolution in Retrospect': interior lines, munitions, time, the absence of a White politics, and the degree of peasant discontent"
      },
      {
        "source": "source:sumpf-2014",
        "note": "the concluding assessment"
      },
      {
        "source": "source:mawdsley-2014",
        "note": "sections 'The Intervention of the Central Powers' and 'The Allies and Kolchak'"
      },
      {
        "source": "source:figes-1996",
        "note": "the peasant argument, stated from the work rather than quoted - no page-level access, see unread"
      }
    ]
  },
  {
    "id": "1918-russian-civil-war:historiography-the-terror",
    "title": "The terror: how much, by whom, and why",
    "question": "The Cheka was told by decree to shoot and to publish the names. The Whites and the Greens killed too, and the pogroms in Ukraine killed on a scale neither. How large was any of it, and is the argument about the numbers actually an argument about numbers?",
    "positions": [
      {
        "label": "Terror was theorised on one side and improvised on the others",
        "who": "Nicolas Werth (2008)",
        "summary": "Werth's framing is deliberately two-handed and both hands matter. 'No single side had a monopoly over violence. It is nevertheless undeniable that the Bolsheviks theorized violence to a far greater extent as \"mass terror\".'[^werth-2008]\n\nOn the Red side he gives what can be given: in the weeks after the decree of 5 September 1918 the Cheka 'carried out two to three times as many executions as the Czarist regime had pronounced death sentences over a 92-year period from 1825 to 1917', with an estimate of ten to fifteen thousand for September and October 1918 alone. On the White side: 'White Terror was never established as a system. Mostly uncontrolled and perpetrated by \"warlords\"'. And the largest single category of killing in the war is neither: approximately 150,000 Jewish victims of the pogroms between 1918 and 1922, 125,000 of them in Ukraine and 25,000 in Belorussia.[^werth-2008] Sumpf gives the same order of magnitude for the pogroms independently.[^sumpf-2014]"
      },
      {
        "label": "Ideology was the font",
        "who": "Richard Pipes, Martin Malia and the authors of The Black Book of Communism - characterised here through Holquist, not read directly",